[
  {
    "id": 1,
    "sku": "SKU-000001",
    "ean13": "8464084688516",
    "name": "Cuchillas de afeitar El Molinar pack 6",
    "category_id": 45,
    "supplier_id": 41,
    "brand": "El Molinar",
    "unit": "pack",
    "unit_price": 12.99,
    "cost_price": 11.5,
    "vat_rate": 0.21,
    "active": true
  },
  {
    "id": 2,
    "sku": "SKU-000002",
    "ean13": "8467189992984",
    "name": "Lavavajillas a mano Doña Elena",
    "category_id": 40,
    "supplier_id": 21,
    "brand": "Doña Elena",
    "unit": "ud",
    "unit_price": 1.49,
    "cost_price": 1.25,
    "vat_rate": 0.21,
    "active": true
  },
  {
    "id": 3,
    "sku": "SKU-000003",
    "ean13": "8413464255923",
    "name": "Frutos secos mezcla La Almazara",
    "category_id": 23,
    "supplier_id": 3,
    "brand": "La Almazara",
    "unit": "ud",
    "unit_price": 2.95,
    "cost_price": 2.53,
    "vat_rate": 0.1,
    "active": true
  },
  {
    "id": 4,
    "sku": "SKU-000004",
    "ean13": "8479360553693",
    "name": "Servilletas Sabor de Antaño pack 12",
    "category_id": 39,
    "supplier_id": 14,
    "brand": "Sabor de Antaño",
    "unit": "pack",
    "unit_price": 1.49,
    "cost_price": 1.19,
    "vat_rate": 0.21,
    "active": true
  },
  {
    "id": 5,
    "sku": "SKU-000005",
    "ean13": "8499968138818",
    "name": "Sal marina Vega Real 1kg",
    "category_id": 20,
    "supplier_id": 18,
    "brand": "Vega Real",
    "unit": "kg",
    "unit_price": 0.99,
    "cost_price": 0.75,
    "vat_rate": 0.1,
    "active": true
  },
  {
    "id": 6,
    "sku": "SKU-000006",
    "ean13": "8484710156806",
    "name": "Detergente líquido Puente Viejo",
    "category_id": 37,
    "supplier_id": 30,
    "brand": "Puente Viejo",
    "unit": "ud",
    "unit_price": 6.99,
    "cost_price": 5.96,
    "vat_rate": 0.21,
    "active": true
  },
  {
    "id": 7,
    "sku": "SKU-000007",
    "ean13": "8411991774610",
    "name": "Néctar de melocotón Monteclaro 1.5L",
    "category_id": 30,
    "supplier_id": 18,
    "brand": "Monteclaro",
    "unit": "L",
    "unit_price": 2.5,
    "cost_price": 2.03,
    "vat_rate": 0.21,
    "active": true
  },
  {
    "id": 8,
    "sku": "SKU-000008",
    "ean13": "8468487664054",
    "name": "Gel infantil Valdehermoso",
    "category_id": 50,
    "supplier_id": 5,
    "brand": "Valdehermoso",
    "unit": "ud",
    "unit_price": 2.99,
    "cost_price": 2.43,
    "vat_rate": 0.04,
    "active": true
  },
  {
    "id": 9,
    "sku": "SKU-000009",
    "ean13": "8426159901470",
    "name": "Fregasuelos Sabor de Antaño",
    "category_id": 38,
    "supplier_id": 19,
    "brand": "Sabor de Antaño",
    "unit": "ud",
    "unit_price": 2.99,
    "cost_price": 2.38,
    "vat_rate": 0.21,
    "active": true
  },
  {
    "id": 10,
    "sku": "SKU-000010",
    "ean13": "8472019319442",
    "name": "Bizcocho Sabor de Antaño",
    "category_id": 22,
    "supplier_id": 11,
    "brand": "Sabor de Antaño",
    "unit": "ud",
    "unit_price": 2.99,
    "cost_price": 2.39,
    "vat_rate": 0.1,
    "active": true
  },
  {
    "id": 11,
    "sku": "SKU-000011",
    "ean13": "8444558478713",
    "name": "Bombilla LED Casa Robles",
    "category_id": 56,
    "supplier_id": 33,
    "brand": "Casa Robles",
    "unit": "ud",
    "unit_price": 4.95,
    "cost_price": 3.91,
    "vat_rate": 0.21,
    "active": true
  },
  {
    "id": 12,
    "sku": "SKU-000012",
    "ean13": "8419256617726",
    "name": "Galletas María Tierra Nuestra",
    "category_id": 22,
    "supplier_id": 25,
    "brand": "Tierra Nuestra",
    "unit": "ud",
    "unit_price": 1.5,
    "cost_price": 1.21,
    "vat_rate": 0.1,
    "active": true
  },
  {
    "id": 13,
    "sku": "SKU-000013",
    "ean13": "8415374004752",
    "name": "Alimento para pájaros Buenamesa",
    "category_id": 53,
    "supplier_id": 33,
    "brand": "Buenamesa",
    "unit": "ud",
    "unit_price": 4.75,
    "cost_price": 4.05,
    "vat_rate": 0.21,
    "active": true
  },
  {
    "id": 14,
    "sku": "SKU-000014",
    "ean13": "8436252599771",
    "name": "Cápsulas de café Monteclaro pack 4",
    "category_id": 31,
    "supplier_id": 12,
    "brand": "Monteclaro",
    "unit": "pack",
    "unit_price": 7.99,
    "cost_price": 7.27,
    "vat_rate": 0.21,
    "active": true
  },
  {
    "id": 15,
    "sku": "SKU-000015",
    "ean13": "8442733767836",
    "name": "Detergente líquido Buenamesa",
    "category_id": 37,
    "supplier_id": 26,
    "brand": "Buenamesa",
    "unit": "ud",
    "unit_price": 7.75,
    "cost_price": 6.67,
    "vat_rate": 0.21,
    "active": true
  },
  {
    "id": 16,
    "sku": "SKU-000016",
    "ean13": "8425177339913",
    "name": "Cepillo de dientes Los Almendros",
    "category_id": 42,
    "supplier_id": 38,
    "brand": "Los Almendros",
    "unit": "ud",
    "unit_price": 2.99,
    "cost_price": 2.33,
    "vat_rate": 0.21,
    "active": true
  },
  {
    "id": 17,
    "sku": "SKU-000017",
    "ean13": "8446295994877",
    "name": "Menestra congelada Buenamesa",
    "category_id": 33,
    "supplier_id": 22,
    "brand": "Buenamesa",
    "unit": "ud",
    "unit_price": 2.49,
    "cost_price": 2.12,
    "vat_rate": 0.1,
    "active": false
  },
  {
    "id": 18,
    "sku": "SKU-000018",
    "ean13": "8467257646924",
    "name": "Refresco de cola Los Almendros pack 4",
    "category_id": 27,
    "supplier_id": 23,
    "brand": "Los Almendros",
    "unit": "pack",
    "unit_price": 4.49,
    "cost_price": 3.54,
    "vat_rate": 0.21,
    "active": true
  },
  {
    "id": 19,
    "sku": "SKU-000019",
    "ean13": "8426990478704",
    "name": "Vino blanco Rueda Doña Elena",
    "category_id": 29,
    "supplier_id": 14,
    "brand": "Doña Elena",
    "unit": "ud",
    "unit_price": 8.99,
    "cost_price": 7.71,
    "vat_rate": 0.21,
    "active": true
  },
  {
    "id": 20,
    "sku": "SKU-000020",
    "ean13": "8419615605227",
    "name": "Zanahoria Sabor de Antaño 500g",
    "category_id": 10,
    "supplier_id": 37,
    "brand": "Sabor de Antaño",
    "unit": "kg",
    "unit_price": 1.99,
    "cost_price": 1.79,
    "vat_rate": 0.04,
    "active": true
  },
  {
    "id": 21,
    "sku": "SKU-000021",
    "ean13": "8444575203411",
    "name": "Desodorante El Molinar",
    "category_id": 47,
    "supplier_id": 1,
    "brand": "El Molinar",
    "unit": "ud",
    "unit_price": 2.49,
    "cost_price": 1.93,
    "vat_rate": 0.21,
    "active": true
  },
  {
    "id": 22,
    "sku": "SKU-000022",
    "ean13": "8497985590268",
    "name": "Pastillas lavavajillas Ribera Alta pack 12",
    "category_id": 40,
    "supplier_id": 1,
    "brand": "Ribera Alta",
    "unit": "pack",
    "unit_price": 8.49,
    "cost_price": 7.16,
    "vat_rate": 0.21,
    "active": true
  },
  {
    "id": 23,
    "sku": "SKU-000023",
    "ean13": "8499739181241",
    "name": "Leche de continuación Origen",
    "category_id": 49,
    "supplier_id": 25,
    "brand": "Origen",
    "unit": "ud",
    "unit_price": 13.99,
    "cost_price": 11.52,
    "vat_rate": 0.04,
    "active": true
  },
  {
    "id": 24,
    "sku": "SKU-000024",
    "ean13": "8418543554126",
    "name": "Bombilla LED Puente Viejo",
    "category_id": 56,
    "supplier_id": 29,
    "brand": "Puente Viejo",
    "unit": "ud",
    "unit_price": 7.5,
    "cost_price": 6.07,
    "vat_rate": 0.21,
    "active": true
  },
  {
    "id": 25,
    "sku": "SKU-000025",
    "ean13": "8405605946807",
    "name": "Limpiacristales Valdehermoso",
    "category_id": 38,
    "supplier_id": 1,
    "brand": "Valdehermoso",
    "unit": "ud",
    "unit_price": 2.49,
    "cost_price": 2.02,
    "vat_rate": 0.21,
    "active": true
  },
  {
    "id": 26,
    "sku": "SKU-000026",
    "ean13": "8484324027844",
    "name": "Lavavajillas a mano Monteclaro",
    "category_id": 40,
    "supplier_id": 15,
    "brand": "Monteclaro",
    "unit": "ud",
    "unit_price": 1.99,
    "cost_price": 1.62,
    "vat_rate": 0.21,
    "active": true
  },
  {
    "id": 27,
    "sku": "SKU-000027",
    "ean13": "8452384934228",
    "name": "Pañales talla 3 El Molinar pack 6",
    "category_id": 48,
    "supplier_id": 28,
    "brand": "El Molinar",
    "unit": "pack",
    "unit_price": 13.95,
    "cost_price": 11.03,
    "vat_rate": 0.04,
    "active": true
  },
  {
    "id": 28,
    "sku": "SKU-000028",
    "ean13": "8429861685225",
    "name": "Café molido natural La Almazara",
    "category_id": 31,
    "supplier_id": 30,
    "brand": "La Almazara",
    "unit": "ud",
    "unit_price": 6.99,
    "cost_price": 5.56,
    "vat_rate": 0.21,
    "active": true
  },
  {
    "id": 29,
    "sku": "SKU-000029",
    "ean13": "8472794978872",
    "name": "Papel higiénico Casa Robles pack 4",
    "category_id": 39,
    "supplier_id": 18,
    "brand": "Casa Robles",
    "unit": "pack",
    "unit_price": 3.5,
    "cost_price": 2.74,
    "vat_rate": 0.21,
    "active": true
  },
  {
    "id": 30,
    "sku": "SKU-000030",
    "ean13": "8477287137576",
    "name": "Bolsas de basura Vega Real pack 4",
    "category_id": 55,
    "supplier_id": 3,
    "brand": "Vega Real",
    "unit": "pack",
    "unit_price": 1.49,
    "cost_price": 0.82,
    "vat_rate": 0.21,
    "active": true
  },
  {
    "id": 31,
    "sku": "SKU-000031",
    "ean13": "8469231880270",
    "name": "Cebolla El Molinar 500g",
    "category_id": 10,
    "supplier_id": 4,
    "brand": "El Molinar",
    "unit": "kg",
    "unit_price": 1.99,
    "cost_price": 1.68,
    "vat_rate": 0.04,
    "active": true
  },
  {
    "id": 32,
    "sku": "SKU-000032",
    "ean13": "8429660256558",
    "name": "Acondicionador Los Almendros",
    "category_id": 43,
    "supplier_id": 35,
    "brand": "Los Almendros",
    "unit": "ud",
    "unit_price": 3.5,
    "cost_price": 2.68,
    "vat_rate": 0.21,
    "active": true
  },
  {
    "id": 33,
    "sku": "SKU-000033",
    "ean13": "8469795343853",
    "name": "Bombilla LED Tierra Nuestra",
    "category_id": 56,
    "supplier_id": 9,
    "brand": "Tierra Nuestra",
    "unit": "ud",
    "unit_price": 3.99,